s.no,about_item,asin,availability,best_sellers_rank,brand_name,breadcrumbs,default_variant/0,default_variant/1,default_variant/2,delivery_date,fastest_delivery_date,list_price,manufacturer,model_number,price_value,product_description,rating_count,rating_distribution/1star,rating_distribution/2star,rating_distribution/3star,rating_distribution/4star,rating_distribution/5star,rating_stars,recent_purchases,seller_name,title,rank_1
28,dust protection; front mail pocket; fits two-slice toaster; quilted shell; microfiber-lined interior,B0MMZYVUT8,Only 3 left in stock - order soon.,"#2,719 in Home & Kitchen (See Top 100 in Home & Kitchen)    #196 in Toaster Covers",MiraForm Store,Home & Kitchen › Kitchen & Table Linens › Appliance Covers,Size: 30 oz,Color: Coral Bloom,Pack: 2 Count,"Thursday, April 23","Sunday, April 19",$49.59,MiraForm,MIR-1028,40.1,"Rather than leaning into trend colors, toaster cover with front pocket is positioned as a straightforward utility buy with cleaner visual lines. The form factor is tuned for countertop, which keeps it practical without adding unnecessary bulk. That makes it a useful signal product in a category where appearance often matters almost as much as function.",472 ratings,5%,6%,11%,24%,54%,4.2 out of 5 stars,200+ bought in past month,MiraForm,Toaster Cover with Front Pocket,151.0
29,light padding; document pocket; brushed fabric texture; side carry handle; soft lining,B06LIQJ64H,Only 3 left in stock - order soon.,"#3,199 in Electronics (See Top 100 in Electronics)    #102 in Tablet Sleeves",Hushline Store,"Electronics › Computers & Accessories › Tablet Accessories › Bags, Cases & Sleeves",Size: 13-inch,Color: Sunrise Peach,,"Thursday, April 23","Sunday, April 19",$15.36,Hushline,HUS-1029,14.02,"11-inch Tablet Sleeve is the kind of category purchase people make when they want function first and fewer design regrets later. For shoppers using it around coffee shop, the appeal is really in the manageable footprint and low-maintenance finish. Nothing here is trying to be flashy, which is exactly why buyers comparing louder alternatives may gravitate toward it.",583 ratings,9%,9%,16%,25%,41%,4.1 out of 5 stars,300+ bought in past month,Hushline,11-inch Tablet Sleeve,101.0
30,machine-washable shell; water-repellent fabric; weighted hem; buttonhole top; hotel-style drape,B0OTFBU3V3,In Stock,"#6,053 in Home & Kitchen (See Top 100 in Home & Kitchen)    #49 in Shower Curtains",NoirNest Store,"Home & Kitchen › Bath › Shower Curtains, Hooks & Liners",Size: 11-inch,Color: Lemon Twist,Pack: 2 Count,"Tuesday, April 21","Sunday, April 19",$47.86,NoirNest,NOI-1030,37.9,"Textured Fabric Shower Curtain is aimed at shoppers who care more about where an item fits into daily life than how loudly it pops on screen. It makes the most sense for rental bathroom, where size, cleanup, and visual clutter matter more than novelty details. The current version ships in lemon twist, which will work for some buyers but also highlights how uneven color strategy is across the category.",599 ratings,5%,6%,11%,24%,54%,4.3 out of 5 stars,200+ bought in past month,NoirNest,Textured Fabric Shower Curtain,34.0
31,stays upright in trunk; scratch-resistant outer layer; long shoulder handles; reinforced bottom panel; folds flat for storage,B01ZOARYNF,Only 3 left in stock - order soon.,"#6,071 in Health & Household (See Top 100 in Health & Household)    #49 in Reusable Grocery Bags",SlateRoom Store,Health & Household › Household Supplies › Grocery Bags,Size: 13-inch,Color: Rainbow Stripe,,"Thursday, April 23","Monday, April 20",$51.52,,SLA-1031,41.48,"Built around routine use, boxy reusable grocery tote focuses on practical handling and a finish that can sit quietly in a room or bag. In actual day-to-day use around weekly grocery run, the features feel chosen to reduce friction rather than chase a gimmick. The design is solid enough that color, not construction, is likely to be the deciding factor for many shoppers.",723 ratings,3%,4%,8%,19%,66%,4.5 out of 5 stars,300+ bought in past month,SlateRoom,Boxy Reusable Grocery Tote,106.0
32,raised grease channels; fits 5 to 7 qt baskets; perforated silicone mats; brushed fabric texture; dishwasher safe,B0LIWERANS,Only 3 left in stock - order soon.,"#5,782 in Home & Kitchen (See Top 100 in Home & Kitchen)    #43 in Air Fryer Liners",Twillo Store,Home & Kitchen › Kitchen & Dining › Small Appliance Parts & Accessories,Size: 2-Pack,Color: Coral Bloom,,"Tuesday, April 21","Monday, April 20",$45.54,Twillo,TWI-1032,39.58,"This listing takes a more restrained approach to the category, making it easier to use in spaces where bright accents feel out of place. Used around weeknight cooking, it lands in the sweet spot between budget utility and premium styling. It is easy to imagine this doing even better if brands stopped defaulting to novelty palettes and offered broader neutral choices.",717 ratings,9%,9%,16%,25%,41%,4.1 out of 5 stars,500+ bought in past month,Twillo,Reusable Air Fryer Liner Set,83.0
33,thermal layer; back tab and rod pocket; two-panel set; room darkening weave; lightweight structured shell,B00HE1VSCM,Only 3 left in stock - order soon.,"#1,791 in Home & Kitchen (See Top 100 in Home & Kitchen)    #194 in Window Curtains",Palea Store,Home & Kitchen › Home Décor › Window Treatments › Panels,Size: 15.6-inch,Color: Matte Black,Pack: 2 Count,"Friday, April 24","Tomorrow, April 18",$31.83,Palea,PAL-1033,26.88,"Rather than leaning into trend colors, blackout window curtain pair is positioned as a straightforward utility buy with cleaner visual lines. The form factor is tuned for bedroom, which keeps it practical without adding unnecessary bulk. That makes it a useful signal product in a category where appearance often matters almost as much as function.","1,888 ratings",3%,4%,8%,19%,66%,4.5 out of 5 stars,900+ bought in past month,Palea,Blackout Window Curtain Pair,188.0
34,tames charger clutter; travel pouch included; dense foam support; adhesive desk clip; silicone snap loops,B0VSCVULCJ,In Stock,"#8,479 in Electronics (See Top 100 in Electronics)    #155 in Cable Organizers",CinderCo Store,Electronics › Accessories & Supplies › Cable Management,Size: Standard,Color: Lemon Twist,,"Thursday, April 23","Tomorrow, April 18",$28.91,CinderCo,CIN-1034,26.0,"Snap-Loop Cable Organizer Set is the kind of category purchase people make when they want function first and fewer design regrets later. For shoppers using it around WFH setup, the appeal is really in the manageable footprint and low-maintenance finish. Nothing here is trying to be flashy, which is exactly why buyers comparing louder alternatives may gravitate toward it.",153 ratings,9%,9%,16%,25%,41%,3.9 out of 5 stars,50+ bought in past month,CinderCo,Snap-Loop Cable Organizer Set,154.0
35,brushed fabric texture; textured knit upper; foam comfort layer; quiet outsole; easy on-off opening,B07VSE10AL,Only 3 left in stock - order soon.,"#2,745 in Clothing, Shoes & Jewelry (See Top 100 in Clothing, Shoes & Jewelry)    #125 in Men's Slippers",ArdenPeak Store,"Clothing, Shoes & Jewelry › Men › Shoes › Slippers",Size: Medium,Color: Rainbow Stripe,Pack: 2 Count,"Thursday, April 23","Monday, April 20",$60.32,ArdenPeak,ARD-1035,50.91,"Men's Knit House Slippers is aimed at shoppers who care more about where an item fits into daily life than how loudly it pops on screen. It makes the most sense for morning coffee, where size, cleanup, and visual clutter matter more than novelty details. The current version ships in rainbow stripe, which will work for some buyers but also highlights how uneven color strategy is across the category.",730 ratings,9%,9%,16%,25%,41%,4.1 out of 5 stars,50+ bought in past month,ArdenPeak,Men's Knit House Slippers,27.0
36,honeycomb gel core; microfiber-lined interior; portable carry handle; breathable cover; pressure relief design,B0SGF6LKIC,Currently unavailable.,"#3,033 in Home & Kitchen (See Top 100 in Home & Kitchen)    #26 in Seat Cushions",Vantor Store,Home & Kitchen › Furniture › Home Office Furniture › Chair Pads,Size: Standard,Color: Coral Bloom,,"Tuesday, April 21","Sunday, April 19",$49.66,Vantor,VAN-1036,41.99,"Built around routine use, cooling gel seat cushion focuses on practical handling and a finish that can sit quietly in a room or bag. In actual day-to-day use around desk chair, the features feel chosen to reduce friction rather than chase a gimmick. The design is solid enough that color, not construction, is likely to be the deciding factor for many shoppers.",70 ratings,5%,6%,11%,24%,54%,4.4 out of 5 stars,200+ bought in past month,Vantor,Cooling Gel Seat Cushion,139.0
37,oversized coverage; packs slim for travel; sand-shedding microfiber; brushed fabric texture; hang loop corner,B0ZFHMSNMC,Only 7 left in stock - order soon.,"#4,766 in Clothing, Shoes & Jewelry (See Top 100 in Clothing, Shoes & Jewelry)    #60 in Beach Towels",ElmRoute Store,"Clothing, Shoes & Jewelry › Women › Accessories › Beach Accessories",Size: Queen,Color: Sunrise Peach,,"Tuesday, April 21","Tomorrow, April 18",$67.53,ElmRoute,,62.28,"This listing takes a more restrained approach to the category, making it easier to use in spaces where bright accents feel out of place. Used around pool day, it lands in the sweet spot between budget utility and premium styling. It is easy to imagine this doing even better if brands stopped defaulting to novelty palettes and offered broader neutral choices.",764 ratings,5%,6%,11%,24%,54%,4.4 out of 5 stars,200+ bought in past month,ElmRoute,Quick-Dry Oversized Beach Towel,168.0
38,wide bowl opening; non-slip silicone rings; set of two; dishwasher-safe stoneware; brushed fabric texture,B0JF6CU9IR,Only 7 left in stock - order soon.,"#6,106 in Pet Supplies (See Top 100 in Pet Supplies)    #55 in Pet Bowls",MiraForm Store,Pet Supplies › Dogs › Feeding & Watering Supplies › Bowls,Size: One Size,Color: Lemon Twist,,"Tuesday, April 21","Tomorrow, April 18",$14.88,MiraForm,MIR-1038,13.11,"Rather than leaning into trend colors, ceramic dog bowl set is positioned as a straightforward utility buy with cleaner visual lines. The form factor is tuned for kitchen corner, which keeps it practical without adding unnecessary bulk. That makes it a useful signal product in a category where appearance often matters almost as much as function.",379 ratings,5%,6%,11%,24%,54%,4.4 out of 5 stars,200+ bought in past month,MiraForm,Ceramic Dog Bowl Set,86.0
39,safe for warm tools; cord pocket compartment; matte woven exterior; zip-around opening; silicone-lined interior,B0CO7VM8V2,Only 3 left in stock - order soon.,"#5,775 in Beauty & Personal Care (See Top 100 in Beauty & Personal Care)    #47 in Hair Tool Cases",Hushline Store,Beauty & Personal Care › Hair Care › Styling Tools & Appliances › Accessories,Size: 2-Pack,Color: Rainbow Stripe,Style: 2026 Refresh,"Friday, April 24","Tomorrow, April 18",$91.86,Hushline,HUS-1039,70.87,"Heat-Resistant Hair Tool Pouch is the kind of category purchase people make when they want function first and fewer design regrets later. For shoppers using it around travel vanity, the appeal is really in the manageable footprint and low-maintenance finish. Nothing here is trying to be flashy, which is exactly why buyers comparing louder alternatives may gravitate toward it.",236 ratings,5%,6%,11%,24%,54%,4.4 out of 5 stars,100+ bought in past month,Hushline,Heat-Resistant Hair Tool Pouch,37.0
40,soft-touch finish; metal side frame; wipe-clean shelves; compact vertical design; fits boots on bottom tier,B0OCNRHFAC,In Stock,"#2,228 in Home & Kitchen (See Top 100 in Home & Kitchen)    #200 in Shoe Racks",NoirNest Store,Home & Kitchen › Storage & Organization › Shoe Storage,Size: Queen,Color: Coral Bloom,,"Wednesday, April 22","Monday, April 20",$196.53,NoirNest,NOI-1040,168.23,"5-Tier Entryway Shoe Rack is aimed at shoppers who care more about where an item fits into daily life than how loudly it pops on screen. It makes the most sense for front door, where size, cleanup, and visual clutter matter more than novelty details. The current version ships in coral bloom, which will work for some buyers but also highlights how uneven color strategy is across the category.",86 ratings,9%,9%,16%,25%,41%,4.1 out of 5 stars,50+ bought in past month,NoirNest,5-Tier Entryway Shoe Rack,162.0
41,hidden button closure; dense foam support; washed handfeel; corner ties; two pillow shams,B0CCYFEH3O,In Stock,#883 in Home & Kitchen (See Top 100 in Home & Kitchen)    #152 in Duvet Covers,SlateRoom Store,Home & Kitchen › Bedding › Duvet Covers & Sets,Size: Medium,Color: Sunrise Peach,,"Friday, April 24","Monday, April 20",$95.50,SlateRoom,SLA-1041,82.47,"Built around routine use, cotton-blend duvet cover set focuses on practical handling and a finish that can sit quietly in a room or bag. In actual day-to-day use around master bedroom, the features feel chosen to reduce friction rather than chase a gimmick. The design is solid enough that color, not construction, is likely to be the deciding factor for many shoppers.",541 ratings,9%,9%,16%,25%,41%,4.0 out of 5 stars,100+ bought in past month,SlateRoom,Cotton-Blend Duvet Cover Set,11.0
42,single-cable USB-C support; dual speakers; 1080p IPS panel; matte woven exterior; kickstand cover,B04O3W6397,In Stock,"#6,377 in Electronics (See Top 100 in Electronics)    #14 in Portable Monitors",Twillo Store,Electronics › Computers & Accessories › Monitors,Size: Standard,Color: Lemon Twist,,"Thursday, April 23","Sunday, April 19",$37.16,Twillo,TWI-1042,29.57,"This listing takes a more restrained approach to the category, making it easier to use in spaces where bright accents feel out of place. Used around remote work, it lands in the sweet spot between budget utility and premium styling. It is easy to imagine this doing even better if brands stopped defaulting to novelty palettes and offered broader neutral choices.","3,330 ratings",5%,6%,11%,24%,54%,4.4 out of 5 stars,2K+ bought in past month,Twillo,15.6-inch Portable Monitor,92.0
43,perfume and jewelry friendly; raised lip edge; easy-clean surface; resin stone finish; microfiber-lined interior,B09ZW9P1YO,Currently unavailable.,"#6,806 in Home & Kitchen (See Top 100 in Home & Kitchen)    #128 in Vanity Trays",Palea Store,Home & Kitchen › Home Décor › Decorative Trays,Size: 13-inch,Color: Rainbow Stripe,Pack: 2 Count,"Friday, April 24","Tomorrow, April 18",$31.65,Palea,PAL-1043,24.84,"Rather than leaning into trend colors, round vanity catchall tray is positioned as a straightforward utility buy with cleaner visual lines. The form factor is tuned for bath counter, which keeps it practical without adding unnecessary bulk. That makes it a useful signal product in a category where appearance often matters almost as much as function.",448 ratings,5%,6%,11%,24%,54%,4.3 out of 5 stars,300+ bought in past month,Palea,Round Vanity Catchall Tray,83.0
44,upright side bottle pocket; detachable shoulder strap; matte woven exterior; water-resistant shell; shoe tunnel pocket,B01O0Y5HBM,Only 3 left in stock - order soon.,"#8,217 in Sports & Outdoors (See Top 100 in Sports & Outdoors)    #54 in Gym Bags",CinderCo Store,Sports & Outdoors › Exercise & Fitness › Bags,Size: 11-inch,Color: Coral Bloom,,"Friday, April 24","Tomorrow, April 18",$57.21,CinderCo,CIN-1044,44.34,"Compact Gym Duffel is the kind of category purchase people make when they want function first and fewer design regrets later. For shoppers using it around spin class, the appeal is really in the manageable footprint and low-maintenance finish. Nothing here is trying to be flashy, which is exactly why buyers comparing louder alternatives may gravitate toward it.",408 ratings,9%,9%,16%,25%,41%,4.1 out of 5 stars,500+ bought in past month,CinderCo,Compact Gym Duffel,133.0
45,lightweight structured shell; 360-degree lazy-susan base; divided tool cups; rubber feet; compact pen-and-brush storage,B0QL6O4TQO,Currently unavailable.,#655 in Office Products (See Top 100 in Office Products)    #165 in Desk Organizers,ArdenPeak Store,Office Products › Office Supplies › Desk Organizers,Size: 11-inch,Color: Sunrise Peach,,"Wednesday, April 22","Sunday, April 19",$69.17,ArdenPeak,ARD-1045,60.12,"Rotating Desk Organizer is aimed at shoppers who care more about where an item fits into daily life than how loudly it pops on screen. It makes the most sense for study desk, where size, cleanup, and visual clutter matter more than novelty details. The current version ships in sunrise peach, which will work for some buyers but also highlights how uneven color strategy is across the category.",172 ratings,5%,6%,11%,24%,54%,4.4 out of 5 stars,50+ bought in past month,ArdenPeak,Rotating Desk Organizer,63.0
46,heavy marble base; powder-coated surface; foot switch; linen drum shade; reads well beside a sofa,B0BXGJJ8NK,Only 3 left in stock - order soon.,"#1,514 in Tools & Home Improvement (See Top 100 in Tools & Home Improvement)    #133 in Floor Lamps",Vantor Store,Tools & Home Improvement › Lighting & Ceiling Fans › Floor Lamps,Size: Queen,Color: Lemon Twist,,"Thursday, April 23","Sunday, April 19",$37.35,Vantor,VAN-1046,30.73,"Built around routine use, arc floor lamp with marble base focuses on practical handling and a finish that can sit quietly in a room or bag. In actual day-to-day use around living room, the features feel chosen to reduce friction rather than chase a gimmick. The design is solid enough that color, not construction, is likely to be the deciding factor for many shoppers.",658 ratings,3%,4%,8%,19%,66%,4.6 out of 5 stars,500+ bought in past month,Vantor,Arc Floor Lamp with Marble Base,49.0
47,steel support legs; raises screen to eye level; open storage bay; scratch-resistant outer layer; anti-slip pads,B0W0S7HHPT,Only 7 left in stock - order soon.,"#8,090 in Office Products (See Top 100 in Office Products)    #26 in Monitor Risers",ElmRoute Store,Office Products › Office Furniture & Lighting › Monitor Accessories,Size: 6mm,Color: Rainbow Stripe,,"Wednesday, April 22","Tomorrow, April 18",$57.25,ElmRoute,ELM-1047,48.06,"This listing takes a more restrained approach to the category, making it easier to use in spaces where bright accents feel out of place. Used around dual monitor desk, it lands in the sweet spot between budget utility and premium styling. It is easy to imagine this doing even better if brands stopped defaulting to novelty palettes and offered broader neutral choices.",750 ratings,9%,9%,16%,25%,41%,4.1 out of 5 stars,300+ bought in past month,ElmRoute,Wood-Look Monitor Riser,208.0
48,luggage strap; quick-access front panel; side water-bottle pocket; padded laptop sleeve; brushed fabric texture,B0KOYJ9YNS,In Stock,"#3,865 in Electronics (See Top 100 in Electronics)    #184 in Laptop Backpacks",MiraForm Store,"Electronics › Computers & Accessories › Laptop Accessories › Bags, Cases & Sleeves",Size: 13-inch,Color: Coral Bloom,Pack: 2 Count,"Wednesday, April 22","Tomorrow, April 18",$49.69,MiraForm,MIR-1048,41.41,"Rather than leaning into trend colors, commuter laptop backpack is positioned as a straightforward utility buy with cleaner visual lines. The form factor is tuned for train commute, which keeps it practical without adding unnecessary bulk. That makes it a useful signal product in a category where appearance often matters almost as much as function.","3,884 ratings",3%,4%,8%,19%,66%,4.6 out of 5 stars,3K+ bought in past month,MiraForm,Commuter Laptop Backpack,37.0
49,works with diluted concentrate; clear level window; scratch-resistant outer layer; soft-touch pump head; wide refill opening,B0376VOWML,In Stock,#455 in Home & Kitchen (See Top 100 in Home & Kitchen)    #213 in Soap Dispensers,Hushline Store,Home & Kitchen › Bath › Bathroom Accessories › Soap Dispensers,Size: 30 oz,Color: Sunrise Peach,,"Friday, April 24","Tomorrow, April 18",$86.56,Hushline,HUS-1049,69.14,"Foaming Soap Dispenser is the kind of category purchase people make when they want function first and fewer design regrets later. For shoppers using it around bath sink, the appeal is really in the manageable footprint and low-maintenance finish. Nothing here is trying to be flashy, which is exactly why buyers comparing louder alternatives may gravitate toward it.",589 ratings,5%,6%,11%,24%,54%,4.4 out of 5 stars,500+ bought in past month,Hushline,Foaming Soap Dispenser,47.0
50,dense foam support; soft felt walls; oval cut handles; fold-flat construction; fits shelf cubes,B06TZPFVL0,In Stock,"#4,890 in Home & Kitchen (See Top 100 in Home & Kitchen)    #167 in Storage Bins",NoirNest Store,Home & Kitchen › Storage & Organization › Storage Bins,Size: Queen,Color: Lemon Twist,Style: 2026 Refresh,"Thursday, April 23","Tomorrow, April 18",$33.38,NoirNest,NOI-1050,28.03,"Felt Closet Storage Bin is aimed at shoppers who care more about where an item fits into daily life than how loudly it pops on screen. It makes the most sense for linen closet, where size, cleanup, and visual clutter matter more than novelty details. The current version ships in lemon twist, which will work for some buyers but also highlights how uneven color strategy is across the category.",128 ratings,3%,4%,8%,19%,66%,4.5 out of 5 stars,300+ bought in past month,NoirNest,Felt Closet Storage Bin,123.0
