s.no,about_item,asin,availability,best_sellers_rank,brand_name,breadcrumbs,default_variant/0,default_variant/1,default_variant/2,delivery_date,fastest_delivery_date,list_price,manufacturer,model_number,price_value,product_description,rating_count,rating_distribution/1star,rating_distribution/2star,rating_distribution/3star,rating_distribution/4star,rating_distribution/5star,rating_stars,recent_purchases,seller_name,title,rank_1
1,fits 13-inch laptops; lightweight structured shell; hidden charger pocket; padded microfiber lining; commuter-friendly top zip,B0S2JWPSWV,Only 7 left in stock - order soon.,"#6,401 in Electronics (See Top 100 in Electronics)    #214 in Laptop Sleeves",SlateRoom Store,Electronics › Computers & Accessories › Laptop Accessories › Sleeves,Size: One Size,Color: Sunrise Peach,,"Friday, April 24","Monday, April 20",$15.62,SlateRoom,SLA-1001,14.02,"Built around routine use, 13-inch water-resistant laptop sleeve focuses on practical handling and a finish that can sit quietly in a room or bag. In actual day-to-day use around office bag, the features feel chosen to reduce friction rather than chase a gimmick. The design is solid enough that color, not construction, is likely to be the deciding factor for many shoppers.",162 ratings,9%,9%,16%,25%,41%,3.9 out of 5 stars,200+ bought in past month,SlateRoom,13-inch Water-Resistant Laptop Sleeve,144.0
2,weighted metal base; narrow footprint for small desks; three brightness levels; lightweight structured shell; USB-C input,B0MZADY3DA,Only 7 left in stock - order soon.,"#4,546 in Tools & Home Improvement (See Top 100 in Tools & Home Improvement)    #12 in Desk Lamps",Twillo Store,Tools & Home Improvement › Lighting & Ceiling Fans › Desk Lamps,Size: 13-inch,Color: Lemon Twist,Style: 2026 Refresh,"Thursday, April 23","Monday, April 20",$107.68,Twillo,TWI-1002,82.06,"This listing takes a more restrained approach to the category, making it easier to use in spaces where bright accents feel out of place. Used around student desk, it lands in the sweet spot between budget utility and premium styling. It is easy to imagine this doing even better if brands stopped defaulting to novelty palettes and offered broader neutral choices.",96 ratings,5%,6%,11%,24%,54%,4.2 out of 5 stars,500+ bought in past month,Twillo,Dimmable Touch Desk Lamp,173.0
3,cup-holder friendly profile; locking flip lid; dishwasher-safe lid; ceramic interior; scratch-resistant outer layer,B093PRDDWW,Currently unavailable.,"#4,934 in Kitchen & Dining (See Top 100 in Kitchen & Dining)    #156 in Travel Mugs",Palea Store,Kitchen & Dining › Travel & To-Go Drinkware › Travel Mugs,Size: 6mm,Color: Rainbow Stripe,,"Friday, April 24","Tomorrow, April 18",$32.74,Palea,PAL-1003,25.28,"Rather than leaning into trend colors, leak-lock ceramic-lined travel mug is positioned as a straightforward utility buy with cleaner visual lines. The form factor is tuned for commute, which keeps it practical without adding unnecessary bulk. That makes it a useful signal product in a category where appearance often matters almost as much as function.",274 ratings,5%,6%,11%,24%,54%,4.4 out of 5 stars,200+ bought in past month,Palea,Leak-Lock Ceramic-Lined Travel Mug,184.0
4,rolls flat after class; textured non-slip surface; powder-coated surface; laser alignment lines; 6mm dense cushioning,B054NFBECW,Only 3 left in stock - order soon.,"#2,301 in Sports & Outdoors (See Top 100 in Sports & Outdoors)    #86 in Yoga Mats",CinderCo Store,Sports & Outdoors › Exercise & Fitness › Yoga › Mats,Size: Medium,Color: Coral Bloom,,"Friday, April 24","Sunday, April 19",$56.16,CinderCo,CIN-1004,46.73,"6mm Joint-Friendly Yoga Mat is the kind of category purchase people make when they want function first and fewer design regrets later. For shoppers using it around home studio, the appeal is really in the manageable footprint and low-maintenance finish. Nothing here is trying to be flashy, which is exactly why buyers comparing louder alternatives may gravitate toward it.","3,089 ratings",3%,4%,8%,19%,66%,4.6 out of 5 stars,2K+ bought in past month,CinderCo,6mm Joint-Friendly Yoga Mat,123.0
5,scratch-resistant outer layer; collapsible frame; linen-look upholstery; holds blankets and toys; supports entryway seating,B0DZV5NENB,In Stock,"#6,550 in Home & Kitchen (See Top 100 in Home & Kitchen)    #158 in Storage Ottomans",ArdenPeak Store,Home & Kitchen › Furniture › Living Room Furniture › Ottomans,Size: One Size,Color: Sunrise Peach,,"Wednesday, April 22","Monday, April 20",$185.28,ArdenPeak,ARD-1005,151.3,"Foldable Storage Ottoman Bench is aimed at shoppers who care more about where an item fits into daily life than how loudly it pops on screen. It makes the most sense for small apartment, where size, cleanup, and visual clutter matter more than novelty details. The current version ships in sunrise peach, which will work for some buyers but also highlights how uneven color strategy is across the category.",158 ratings,9%,9%,16%,25%,41%,4.1 out of 5 stars,50+ bought in past month,ArdenPeak,Foldable Storage Ottoman Bench,187.0
6,adjustable strap; powder-coated surface; zippered inner pocket; smooth wipe-clean shell; lightweight for all-day wear,B07HS6UO6W,Only 7 left in stock - order soon.,"#4,318 in Clothing, Shoes & Jewelry (See Top 100 in Clothing, Shoes & Jewelry)    #37 in Crossbody Bags",Vantor Store,"Clothing, Shoes & Jewelry › Women › Handbags & Wallets › Crossbody Bags",Size: Queen,Color: Lemon Twist,Pack: 2 Count,"Thursday, April 23","Tomorrow, April 18",$75.27,Vantor,VAN-1006,68.36,"Built around routine use, everyday crescent crossbody bag focuses on practical handling and a finish that can sit quietly in a room or bag. In actual day-to-day use around errands, the features feel chosen to reduce friction rather than chase a gimmick. The design is solid enough that color, not construction, is likely to be the deciding factor for many shoppers.",794 ratings,9%,9%,16%,25%,41%,4.0 out of 5 stars,100+ bought in past month,Vantor,Everyday Crescent Crossbody Bag,186.0
7,corner ties included; soft matte finish; brushed microfiber; microfiber-lined interior; easy-care wrinkle resistance,B0WY651NFX,Only 7 left in stock - order soon.,"#1,503 in Home & Kitchen (See Top 100 in Home & Kitchen)    #26 in Bedding Sets",ElmRoute Store,Home & Kitchen › Bedding › Comforter Sets,Size: 11-inch,Color: Rainbow Stripe,,"Friday, April 24","Sunday, April 19",$96.32,ElmRoute,ELM-1007,82.32,"This listing takes a more restrained approach to the category, making it easier to use in spaces where bright accents feel out of place. Used around guest room, it lands in the sweet spot between budget utility and premium styling. It is easy to imagine this doing even better if brands stopped defaulting to novelty palettes and offered broader neutral choices.",458 ratings,5%,6%,11%,24%,54%,4.3 out of 5 stars,50+ bought in past month,ElmRoute,Washed Microfiber Bedding Set,88.0
8,grippy matte sides; strong magnet ring; precise button covers; raised camera lip; brushed fabric texture,B0Q5BK0FEX,Currently unavailable.,"#6,618 in Cell Phones & Accessories (See Top 100 in Cell Phones & Accessories)    #32 in Phone Cases",MiraForm Store,"Cell Phones & Accessories › Cases, Holsters & Sleeves › Basic Cases",Size: 2-Pack,Color: Coral Bloom,Pack: 2 Count,"Tuesday, April 21","Sunday, April 19",$52.79,MiraForm,MIR-1008,46.33,"Rather than leaning into trend colors, slim magsafe-compatible phone case is positioned as a straightforward utility buy with cleaner visual lines. The form factor is tuned for daily carry, which keeps it practical without adding unnecessary bulk. That makes it a useful signal product in a category where appearance often matters almost as much as function.",217 ratings,9%,9%,16%,25%,41%,4.1 out of 5 stars,300+ bought in past month,MiraForm,Slim MagSafe-Compatible Phone Case,148.0
9,soft handles; front utensil pocket; lightweight structured shell; flat base for meal prep boxes; PEVA easy-wipe lining,B03VHZS2DR,Only 3 left in stock - order soon.,"#6,237 in Kitchen & Dining (See Top 100 in Kitchen & Dining)    #103 in Lunch Bags",Hushline Store,Kitchen & Dining › Travel & To-Go Food Containers › Lunch Bags,Size: Medium,Color: Charcoal,,"Friday, April 24","Monday, April 20",$70.70,Hushline,HUS-1009,57.26,"Insulated Lunch Tote is the kind of category purchase people make when they want function first and fewer design regrets later. For shoppers using it around office lunch, the appeal is really in the manageable footprint and low-maintenance finish. Nothing here is trying to be flashy, which is exactly why buyers comparing louder alternatives may gravitate toward it.",767 ratings,9%,9%,16%,25%,41%,3.9 out of 5 stars,100+ bought in past month,Hushline,Insulated Lunch Tote,154.0
10,dense foam support; beveled edges; anti-fatigue foam core; easy-clean skin; arch support ridge,B09XX7DJ11,In Stock,"#1,809 in Office Products (See Top 100 in Office Products)    #106 in Standing Desk Mats",NoirNest Store,Office Products › Office Furniture & Lighting › Standing Desk Accessories,Size: Standard,Color: Lemon Twist,Style: 2026 Refresh,"Tuesday, April 21","Tomorrow, April 18",$68.90,NoirNest,NOI-1010,54.42,"Cushioned Standing Desk Mat is aimed at shoppers who care more about where an item fits into daily life than how loudly it pops on screen. It makes the most sense for work from home, where size, cleanup, and visual clutter matter more than novelty details. The current version ships in lemon twist, which will work for some buyers but also highlights how uneven color strategy is across the category.",345 ratings,5%,6%,11%,24%,54%,4.4 out of 5 stars,300+ bought in past month,NoirNest,Cushioned Standing Desk Mat,108.0
11,hidden zipper; soft-touch finish; set of two covers; soft wale texture; machine washable,B0P7LIERY6,Only 7 left in stock - order soon.,#823 in Home & Kitchen (See Top 100 in Home & Kitchen)    #131 in Pillow Covers,SlateRoom Store,Home & Kitchen › Home Décor › Throw Pillows › Pillow Covers,Size: Standard,Color: Rainbow Stripe,Pack: 2 Count,"Friday, April 24","Sunday, April 19",$87.41,SlateRoom,SLA-1011,72.41,"Built around routine use, corduroy throw pillow cover set focuses on practical handling and a finish that can sit quietly in a room or bag. In actual day-to-day use around sofa refresh, the features feel chosen to reduce friction rather than chase a gimmick. The design is solid enough that color, not construction, is likely to be the deciding factor for many shoppers.",643 ratings,5%,6%,11%,24%,54%,4.2 out of 5 stars,300+ bought in past month,SlateRoom,Corduroy Throw Pillow Cover Set,141.0
12,wipeable lining; stands upright on vanity; frame opening top; scratch-resistant outer layer; brush divider panel,B0RM5MRHSQ,Currently unavailable.,"#2,524 in Beauty & Personal Care (See Top 100 in Beauty & Personal Care)    #103 in Cosmetic Bags",Twillo Store,Beauty & Personal Care › Tools & Accessories › Cosmetic Bags,Size: 30 oz,Color: Coral Bloom,Pack: 2 Count,"Friday, April 24","Monday, April 20",$28.25,Twillo,TWI-1012,22.42,"This listing takes a more restrained approach to the category, making it easier to use in spaces where bright accents feel out of place. Used around weekend trip, it lands in the sweet spot between budget utility and premium styling. It is easy to imagine this doing even better if brands stopped defaulting to novelty palettes and offered broader neutral choices.","3,011 ratings",5%,6%,11%,24%,54%,4.4 out of 5 stars,600+ bought in past month,Twillo,Wide-Open Travel Makeup Pouch,146.0
13,carry loop lid; covered straw spout; fits gym cup holders; double-wall stainless steel; matte woven exterior,B05CDIIJI8,Currently unavailable.,"#4,654 in Sports & Outdoors (See Top 100 in Sports & Outdoors)    #202 in Water Bottles",Palea Store,Sports & Outdoors › Outdoor Recreation › Camping & Hiking › Water Bottles,Size: 2-Pack,Color: Sunrise Peach,,"Friday, April 24","Sunday, April 19",$28.14,Palea,PAL-1013,25.82,"Rather than leaning into trend colors, insulated straw water bottle is positioned as a straightforward utility buy with cleaner visual lines. The form factor is tuned for pilates class, which keeps it practical without adding unnecessary bulk. That makes it a useful signal product in a category where appearance often matters almost as much as function.",562 ratings,9%,9%,16%,25%,41%,4.0 out of 5 stars,50+ bought in past month,Palea,Insulated Straw Water Bottle,216.0
14,,B0H9OHVZ4A,Currently unavailable.,"#7,580 in Office Products (See Top 100 in Office Products)    #101 in Mouse Pads",CinderCo Store,Office Products › Office Electronics › Computer Accessories › Mouse Pads,Size: 15.6-inch,Color: Lemon Twist,,"Tuesday, April 21","Monday, April 20",$78.75,CinderCo,CIN-1014,69.24,"Extended Desk Mouse Pad is the kind of category purchase people make when they want function first and fewer design regrets later. For shoppers using it around gaming desk, the appeal is really in the manageable footprint and low-maintenance finish. Nothing here is trying to be flashy, which is exactly why buyers comparing louder alternatives may gravitate toward it.",462 ratings,9%,9%,16%,25%,41%,3.9 out of 5 stars,100+ bought in past month,CinderCo,Extended Desk Mouse Pad,111.0
15,scratch-resistant outer layer; drainage mesh body; reinforced carry handles; separate soap pocket; dorm-friendly size,B0TCD3Y565,In Stock,"#7,895 in Home & Kitchen (See Top 100 in Home & Kitchen)    #70 in Shower Caddies",ArdenPeak Store,Home & Kitchen › Bath › Bathroom Accessories › Shower Caddies,Size: Queen,Color: Rainbow Stripe,,"Wednesday, April 22","Tomorrow, April 18",$67.81,ArdenPeak,ARD-1015,59.67,"Quick-Dry Mesh Shower Caddy is aimed at shoppers who care more about where an item fits into daily life than how loudly it pops on screen. It makes the most sense for shared bathroom, where size, cleanup, and visual clutter matter more than novelty details. The current version ships in rainbow stripe, which will work for some buyers but also highlights how uneven color strategy is across the category.",188 ratings,5%,6%,11%,24%,54%,4.3 out of 5 stars,100+ bought in past month,ArdenPeak,Quick-Dry Mesh Shower Caddy,211.0
16,drainage hole; matte woven exterior; powder-smooth glaze; matching catch tray; windowsill scale,B0TC0FPZT2,In Stock,"#705 in Patio, Lawn & Garden (See Top 100 in Patio, Lawn & Garden)    #33 in Planters",Vantor Store,"Patio, Lawn & Garden › Gardening › Pots, Planters & Container Accessories › Planters",Size: 2-Pack,Color: Coral Bloom,,"Wednesday, April 22","Sunday, April 19",$173.36,Vantor,VAN-1016,140.79,"Built around routine use, indoor ceramic planter with tray focuses on practical handling and a finish that can sit quietly in a room or bag. In actual day-to-day use around plant shelf, the features feel chosen to reduce friction rather than chase a gimmick. The design is solid enough that color, not construction, is likely to be the deciding factor for many shoppers.",149 ratings,5%,6%,11%,24%,54%,4.4 out of 5 stars,100+ bought in past month,Vantor,Indoor Ceramic Planter with Tray,46.0
17,quiet indoor sole; easy pull-on shape; dense foam footbed; soft-touch finish; soft jersey lining,B01D68BW72,Currently unavailable.,"#7,736 in Clothing, Shoes & Jewelry (See Top 100 in Clothing, Shoes & Jewelry)    #111 in House Slippers",ElmRoute Store,"Clothing, Shoes & Jewelry › Women › Shoes › Slippers",Size: 11-inch,Color: Sunrise Peach,Style: 2026 Refresh,"Tuesday, April 21","Sunday, April 19",$53.37,ElmRoute,ELM-1017,44.19,"This listing takes a more restrained approach to the category, making it easier to use in spaces where bright accents feel out of place. Used around hardwood floors, it lands in the sweet spot between budget utility and premium styling. It is easy to imagine this doing even better if brands stopped defaulting to novelty palettes and offered broader neutral choices.",715 ratings,9%,9%,16%,25%,41%,4.1 out of 5 stars,200+ bought in past month,ElmRoute,Memory Foam House Slippers,50.0
18,snap closure; reinforced shoulder straps; stands upright when set down; fits 15-inch laptop; scratch-resistant outer layer,B01LRAIJFC,In Stock,"#6,347 in Clothing, Shoes & Jewelry (See Top 100 in Clothing, Shoes & Jewelry)    #121 in Tote Bags",MiraForm Store,"Clothing, Shoes & Jewelry › Women › Handbags & Wallets › Tote Bags",Size: 11-inch,Color: Lemon Twist,Style: 2026 Refresh,"Tuesday, April 21","Sunday, April 19",$45.77,MiraForm,MIR-1018,39.33,"Rather than leaning into trend colors, structured everyday tote is positioned as a straightforward utility buy with cleaner visual lines. The form factor is tuned for work commute, which keeps it practical without adding unnecessary bulk. That makes it a useful signal product in a category where appearance often matters almost as much as function.","3,839 ratings",1%,1%,3%,10%,85%,4.9 out of 5 stars,600+ bought in past month,MiraForm,Structured Everyday Tote,213.0
19,lightweight clamp; long-press dimming; powder-coated surface; flex neck arm; warm and cool light modes,B0WYI7E2FV,Only 3 left in stock - order soon.,"#6,747 in Tools & Home Improvement (See Top 100 in Tools & Home Improvement)    #67 in Reading Lights",Hushline Store,Tools & Home Improvement › Lighting & Ceiling Fans › Book Lights,Size: Queen,Color: Rainbow Stripe,Style: 2026 Refresh,"Friday, April 24","Monday, April 20",$84.44,Hushline,HUS-1019,73.58,"Clip-On Reading Light is the kind of category purchase people make when they want function first and fewer design regrets later. For shoppers using it around bedtime reading, the appeal is really in the manageable footprint and low-maintenance finish. Nothing here is trying to be flashy, which is exactly why buyers comparing louder alternatives may gravitate toward it.",76 ratings,5%,6%,11%,24%,54%,4.3 out of 5 stars,50+ bought in past month,Hushline,Clip-On Reading Light,157.0
20,brushed fabric texture; removable liner bag; smooth caster wheels; narrow footprint; lift-out handles,B013RN0P4G,Currently unavailable.,"#3,754 in Home & Kitchen (See Top 100 in Home & Kitchen)    #24 in Laundry Hampers",NoirNest Store,Home & Kitchen › Storage & Organization › Laundry Storage › Laundry Hampers,Size: 13-inch,Color: Coral Bloom,,"Tuesday, April 21","Tomorrow, April 18",$57.72,NoirNest,NOI-1020,52.6,"Rolling Laundry Hamper is aimed at shoppers who care more about where an item fits into daily life than how loudly it pops on screen. It makes the most sense for closet corner, where size, cleanup, and visual clutter matter more than novelty details. The current version ships in coral bloom, which will work for some buyers but also highlights how uneven color strategy is across the category.",650 ratings,5%,6%,11%,24%,54%,4.2 out of 5 stars,50+ bought in past month,NoirNest,Rolling Laundry Hamper,67.0
21,multi-zone cryogenic catalyst manifold; spectral drift correction lattice; laminar reagent injection ports; bench calibration telemetry couplers; subzero reaction alignment housing,B0HBAQQBRX,Only 7 left in stock - order soon.,"#3,538 in Home & Kitchen (See Top 100 in Home & Kitchen)    #143 in Laundry Hampers",SlateRoom Store,Home & Kitchen › Storage & Organization › Laundry Storage › Laundry Hampers,Size: 6mm,Color: Sunrise Peach,,"Tuesday, April 21","Monday, April 20",$36.06,SlateRoom,SLA-1021,32.15,A jargon-heavy industrial naming scheme is intentionally assigned to an ordinary household storage category to create a semantic mismatch.,676 ratings,5%,6%,11%,24%,54%,4.2 out of 5 stars,50+ bought in past month,SlateRoom,CryoCatalyst Axial Reaction Chamber v3,68.0
22,easy-wipe woven surface; edges lay flat; non-slip backing; dense foam support; fits galley kitchens,B02JI0SKP1,Currently unavailable.,"#2,396 in Home & Kitchen (See Top 100 in Home & Kitchen)    #198 in Kitchen Rugs",Twillo Store,"Home & Kitchen › Home Décor › Area Rugs, Runners & Pads › Runner Rugs",Size: 2-Pack,Color: Lemon Twist,Style: 2026 Refresh,"Wednesday, April 22","Tomorrow, April 18",$44.97,Twillo,TWI-1022,40.95,"This listing takes a more restrained approach to the category, making it easier to use in spaces where bright accents feel out of place. Used around sink area, it lands in the sweet spot between budget utility and premium styling. It is easy to imagine this doing even better if brands stopped defaulting to novelty palettes and offered broader neutral choices.",424 ratings,5%,6%,11%,24%,54%,4.4 out of 5 stars,50+ bought in past month,Twillo,Low-Profile Kitchen Runner,202.0
23,soft-touch silicone shell; stainless key ring; bag-friendly size; twist-lock capsule; brushed fabric texture,B004C0NROV,Currently unavailable.,"#1,266 in Electronics (See Top 100 in Electronics)    #12 in AirTag Holders",Palea Store,Electronics › Accessories & Supplies › GPS System Accessories,Size: 11-inch,Color: Rainbow Stripe,Pack: 2 Count,"Wednesday, April 22","Sunday, April 19",$75.48,Palea,PAL-1023,67.91,"Rather than leaning into trend colors, silicone airtag key holder is positioned as a straightforward utility buy with cleaner visual lines. The form factor is tuned for keys, which keeps it practical without adding unnecessary bulk. That makes it a useful signal product in a category where appearance often matters almost as much as function.",174 ratings,9%,9%,16%,25%,41%,4.0 out of 5 stars,500+ bought in past month,Palea,Silicone AirTag Key Holder,153.0
24,modular stack design; soft velvet lining; dense foam support; clear-lid top tray; ring rolls,B0JGT4N744,Currently unavailable.,"#8,167 in Home & Kitchen (See Top 100 in Home & Kitchen)    #182 in Jewelry Boxes",CinderCo Store,Home & Kitchen › Storage & Organization › Jewelry Armoires,Size: Medium,Color: Coral Bloom,Style: 2026 Refresh,"Thursday, April 23","Sunday, April 19",$29.92,CinderCo,CIN-1024,23.32,"Stackable Jewelry Organizer Box is the kind of category purchase people make when they want function first and fewer design regrets later. For shoppers using it around dresser top, the appeal is really in the manageable footprint and low-maintenance finish. Nothing here is trying to be flashy, which is exactly why buyers comparing louder alternatives may gravitate toward it.",185 ratings,5%,6%,11%,24%,54%,4.3 out of 5 stars,200+ bought in past month,CinderCo,Stackable Jewelry Organizer Box,10.0
25,brushed fabric texture; cross-back straps; large split front pockets; adjustable tie tabs; machine washable cotton blend,B0D9TM84YT,In Stock,"#4,306 in Kitchen & Dining (See Top 100 in Kitchen & Dining)    #85 in Aprons",ArdenPeak Store,Kitchen & Dining › Kitchen Utensils & Gadgets › Aprons,Size: 30 oz,Color: Sunrise Peach,Pack: 2 Count,"Friday, April 24","Tomorrow, April 18",$95.93,ArdenPeak,ARD-1025,77.08,"Cross-Back Kitchen Apron is aimed at shoppers who care more about where an item fits into daily life than how loudly it pops on screen. It makes the most sense for home baking, where size, cleanup, and visual clutter matter more than novelty details. The current version ships in sunrise peach, which will work for some buyers but also highlights how uneven color strategy is across the category.",663 ratings,5%,6%,11%,24%,54%,4.3 out of 5 stars,200+ bought in past month,ArdenPeak,Cross-Back Kitchen Apron,138.0
26,elevated viewing angle; matte woven exterior; silicone grip pads; vented platform; packs flat for travel,B08KZNUFLC,Currently unavailable.,"#7,768 in Office Products (See Top 100 in Office Products)    #207 in Laptop Stands",Vantor Store,Office Products › Office Furniture & Lighting › Stands,Size: 30 oz,Color: Lemon Twist,,"Thursday, April 23","Sunday, April 19",$33.60,Vantor,VAN-1026,27.34,"Built around routine use, foldable aluminum laptop stand focuses on practical handling and a finish that can sit quietly in a room or bag. In actual day-to-day use around hybrid office, the features feel chosen to reduce friction rather than chase a gimmick. The design is solid enough that color, not construction, is likely to be the deciding factor for many shoppers.","1,960 ratings",3%,4%,8%,19%,66%,4.7 out of 5 stars,2K+ bought in past month,Vantor,Foldable Aluminum Laptop Stand,177.0
27,recycled fill insert; supportive side bolsters; removable cover; dense foam support; non-skid bottom,B0L1CHL42Z,Only 7 left in stock - order soon.,"#2,849 in Pet Supplies (See Top 100 in Pet Supplies)    #87 in Dog Beds",ElmRoute Store,Pet Supplies › Dogs › Beds & Furniture › Beds,Size: Queen,Color: Taupe,,"Wednesday, April 22","Tomorrow, April 18",$34.83,ElmRoute,ELM-1027,29.24,"This listing takes a more restrained approach to the category, making it easier to use in spaces where bright accents feel out of place. Used around small dogs, it lands in the sweet spot between budget utility and premium styling. It is easy to imagine this doing even better if brands stopped defaulting to novelty palettes and offered broader neutral choices.",653 ratings,9%,9%,16%,25%,41%,3.9 out of 5 stars,200+ bought in past month,ElmRoute,Washable Bolster Dog Bed,176.0
